{
  "schema_version": "codenoesis.knowledge-graph/v1",
  "ontology_version": "codenoesis.ontology/rust/v1",
  "repository": {
    "identity": "urn:codenoesis:fixture:s2-rust-knowledge-v1",
    "object_format": "sha1",
    "commit_oid": "d77c36ec27d878cee6d5d85d761de2b70284cd55"
  },
  "extractor_versions": [
    "codenoesis.rust-tree-sitter/s2-v1"
  ],
  "semantic_hash": {
    "algorithm": "blake3-256",
    "domain": "codenoesis.knowledge-graph.semantic.v1",
    "value": "75511bc1b6f4852945406f0222ff5e11b6139431d644d83a12c527b923c257cd"
  },
  "entities": [
    {
      "entity_id": "urn:codenoesis:entity:blake3:0a195444f051a12e6f5597b24c410aac0217a391394a131184a118cdffdec992",
      "kind": "rust.function",
      "canonical_identity": "crate::catalog::make_item",
      "display_name": "make_item",
      "language": "rust",
      "properties": {
        "visibility": "public"
      },
      "evidence_ids": [
        "evidence-s2-0011"
      ],
      "claim_id": "urn:codenoesis:claim:blake3:62f36c65d256d7555182d6bd5d4d69d3670e342c0921691f1f7a62d7534dd553"
    },
    {
      "entity_id": "urn:codenoesis:entity:blake3:11e4fbcfea4e1daa255e129d1f90760bac6fbd06c4a274ac44116cf9fd9c43d8",
      "kind": "source.file",
      "canonical_identity": "file:src/lib.rs",
      "display_name": "src/lib.rs",
      "language": "rust",
      "properties": {
        "path": "src/lib.rs"
      },
      "evidence_ids": [
        "evidence-s2-0000"
      ],
      "claim_id": "urn:codenoesis:claim:blake3:210e175dc0de0e55a9f33cd7100fdc4f6abf7daf9619c0189640ddcdf3eb0ad3"
    },
    {
      "entity_id": "urn:codenoesis:entity:blake3:42e9eea0b507e2cfd901578d555de839eaeb70fa5cf25ca6b8cb591824d6e3e9",
      "kind": "rust.type_alias",
      "canonical_identity": "crate::ItemId",
      "display_name": "ItemId",
      "language": "rust",
      "properties": {
        "visibility": "public"
      },
      "evidence_ids": [
        "evidence-s2-0002"
      ],
      "claim_id": "urn:codenoesis:claim:blake3:a6dc9da6896010c1b0c6e90d64d40cf41d00aa26dc042d394b7abbc89d20a449"
    },
    {
      "entity_id": "urn:codenoesis:entity:blake3:446c78db70ea6ef172b260f1872ce66089def9d85724f89bff0b250af15e52b0",
      "kind": "rust.trait",
      "canonical_identity": "crate::Describable",
      "display_name": "Describable",
      "language": "rust",
      "properties": {
        "visibility": "public"
      },
      "evidence_ids": [
        "evidence-s2-0003"
      ],
      "claim_id": "urn:codenoesis:claim:blake3:e64d01ca1ea6a71062b127e6ebb085b4c419b1d20085fb24bff92f2c6d8902bf"
    },
    {
      "entity_id": "urn:codenoesis:entity:blake3:4d9456713dc810a6fd2773c6728fb5e7174c74f79bb83f077138ad921cda74d1",
      "kind": "rust.module",
      "canonical_identity": "crate::catalog",
      "display_name": "catalog",
      "language": "rust",
      "properties": {
        "visibility": "public"
      },
      "evidence_ids": [
        "evidence-s2-0005"
      ],
      "claim_id": "urn:codenoesis:claim:blake3:f5d1e35fc041a9f2170af8e0c0441949099bcf6943e7815a74f477e3809f469e"
    },
    {
      "entity_id": "urn:codenoesis:entity:blake3:59380e6ebf61df2f35cefef5e33669b615f17738cc3ad73e13f77aabd9576b12",
      "kind": "rust.enum",
      "canonical_identity": "crate::catalog::Store",
      "display_name": "Store",
      "language": "rust",
      "properties": {
        "visibility": "public"
      },
      "evidence_ids": [
        "evidence-s2-0008"
      ],
      "claim_id": "urn:codenoesis:claim:blake3:7dee81247749fa66fc32a3036286c67301c419e1487b52d390e1d2bb70aa6b87"
    },
    {
      "entity_id": "urn:codenoesis:entity:blake3:7189750340341df31fd2258285dd3f23e09914b6c76a6901064905a7aa94a8f9",
      "kind": "rust.function",
      "canonical_identity": "crate::café_label",
      "display_name": "café_label",
      "language": "rust",
      "properties": {
        "visibility": "public"
      },
      "evidence_ids": [
        "evidence-s2-0012"
      ],
      "claim_id": "urn:codenoesis:claim:blake3:97f415d10e4c32c97aba46119bb3c9d6293b2c28ab05d66030ffeb80c09efe69"
    },
    {
      "entity_id": "urn:codenoesis:entity:blake3:cdab9c25defac0b5e22928b4abb05850d7e48b7e6b8c6b03cc8cf948fa3f1fb1",
      "kind": "rust.method",
      "canonical_identity": "crate::Describable::describe",
      "display_name": "describe",
      "language": "rust",
      "properties": {
        "owner_kind": "rust.trait",
        "visibility": "inherited_trait"
      },
      "evidence_ids": [
        "evidence-s2-0004"
      ],
      "claim_id": "urn:codenoesis:claim:blake3:460b1d72ce5a207822c65563f4526ad057cc1e9ed4f3a896fa80630e0811413b"
    },
    {
      "entity_id": "urn:codenoesis:entity:blake3:df3550a554d68000802bac3e1dd477fcce22fabeb83e60566052bf6e33008627",
      "kind": "rust.method",
      "canonical_identity": "crate::catalog::Item::describe",
      "display_name": "describe",
      "language": "rust",
      "properties": {
        "owner_kind": "rust.struct",
        "visibility": "inherited_trait"
      },
      "evidence_ids": [
        "evidence-s2-0010"
      ],
      "claim_id": "urn:codenoesis:claim:blake3:64401844cf4717f2746529a90e3bac5896bcc8ef27f6cfd06acc8fd7ab179d17"
    },
    {
      "entity_id": "urn:codenoesis:entity:blake3:df3ec7670cebe2dedf4deb17000a4dabdce69e7fd81864914d5644d1a58ad363",
      "kind": "rust.crate",
      "canonical_identity": "crate",
      "display_name": "crate",
      "language": "rust",
      "properties": {
        "crate_root": "src/lib.rs"
      },
      "evidence_ids": [
        "evidence-s2-0000"
      ],
      "claim_id": "urn:codenoesis:claim:blake3:a71bee7c53f82ccd88f0327ba64e2f3a88b35cfff4b08aca6bdc39919c30320c"
    },
    {
      "entity_id": "urn:codenoesis:entity:blake3:f21ff02e6cccd3435772daf7f8d75a729ff410f51566e48923e9efac9eea5827",
      "kind": "rust.struct",
      "canonical_identity": "crate::catalog::Item",
      "display_name": "Item",
      "language": "rust",
      "properties": {
        "visibility": "public"
      },
      "evidence_ids": [
        "evidence-s2-0007"
      ],
      "claim_id": "urn:codenoesis:claim:blake3:5a04ecb7a49dc464ac398c411565364cbaf621ffe9ddefbd0c65c6ef3b10bf53"
    }
  ],
  "relationships": [
    {
      "relationship_id": "urn:codenoesis:relationship:blake3:07e1156991a73942740bd67fd6bdda9359f5ce9a98f10f4ad4a8109bc9cdf146",
      "kind": "IMPORTS",
      "source_entity_id": "urn:codenoesis:entity:blake3:df3ec7670cebe2dedf4deb17000a4dabdce69e7fd81864914d5644d1a58ad363",
      "target_entity_id": "urn:codenoesis:entity:blake3:f21ff02e6cccd3435772daf7f8d75a729ff410f51566e48923e9efac9eea5827",
      "evidence_ids": [
        "evidence-s2-0001"
      ],
      "claim_id": "urn:codenoesis:claim:blake3:50fb2182413adea8ee8013235fbd1d21926a31dec1f1a56dc0cf003f0bafbae6"
    },
    {
      "relationship_id": "urn:codenoesis:relationship:blake3:0fbfcb093f56cdbe889ac5fba7f5c743a0e55bf10187516142238776f36d73c8",
      "kind": "IMPLEMENTS",
      "source_entity_id": "urn:codenoesis:entity:blake3:f21ff02e6cccd3435772daf7f8d75a729ff410f51566e48923e9efac9eea5827",
      "target_entity_id": "urn:codenoesis:entity:blake3:446c78db70ea6ef172b260f1872ce66089def9d85724f89bff0b250af15e52b0",
      "evidence_ids": [
        "evidence-s2-0009"
      ],
      "claim_id": "urn:codenoesis:claim:blake3:bf37097101c1b9fca64cd7f231d8a9087bf64b131ddc64687f75af04ceb1474b"
    },
    {
      "relationship_id": "urn:codenoesis:relationship:blake3:1d8a3be8878ad0f0f487f9fba2cf5ba43d82c60f0143189ccb8da967b4ad0997",
      "kind": "DEFINES",
      "source_entity_id": "urn:codenoesis:entity:blake3:4d9456713dc810a6fd2773c6728fb5e7174c74f79bb83f077138ad921cda74d1",
      "target_entity_id": "urn:codenoesis:entity:blake3:0a195444f051a12e6f5597b24c410aac0217a391394a131184a118cdffdec992",
      "evidence_ids": [
        "evidence-s2-0011"
      ],
      "claim_id": "urn:codenoesis:claim:blake3:1546d3b71ccbc29ddd79e13b20b5b2b2196364348c3d4c2418d43f499d84e8c2"
    },
    {
      "relationship_id": "urn:codenoesis:relationship:blake3:340fa1e582c6ff9d6d8a5a426f001b55334053b3d36a3e925ab14a4a5ae1c868",
      "kind": "IMPORTS",
      "source_entity_id": "urn:codenoesis:entity:blake3:4d9456713dc810a6fd2773c6728fb5e7174c74f79bb83f077138ad921cda74d1",
      "target_entity_id": "urn:codenoesis:entity:blake3:42e9eea0b507e2cfd901578d555de839eaeb70fa5cf25ca6b8cb591824d6e3e9",
      "evidence_ids": [
        "evidence-s2-0006"
      ],
      "claim_id": "urn:codenoesis:claim:blake3:efb5737f2e69d2b01447084ef3370acb7b0a95ee5f6445fce82eaab4141f1504"
    },
    {
      "relationship_id": "urn:codenoesis:relationship:blake3:3d475e875685b31867163f2557d5d38084069e7886a6b12c390a00dad528c8b8",
      "kind": "DEFINES",
      "source_entity_id": "urn:codenoesis:entity:blake3:df3ec7670cebe2dedf4deb17000a4dabdce69e7fd81864914d5644d1a58ad363",
      "target_entity_id": "urn:codenoesis:entity:blake3:42e9eea0b507e2cfd901578d555de839eaeb70fa5cf25ca6b8cb591824d6e3e9",
      "evidence_ids": [
        "evidence-s2-0002"
      ],
      "claim_id": "urn:codenoesis:claim:blake3:4d47435500ef55722e84d9b1365357ca729a30e905475f2eb51407d40e4abd1d"
    },
    {
      "relationship_id": "urn:codenoesis:relationship:blake3:50c6fc588db8a468de898d8a3a56071619372b25f7610ffd5199b4c275bef032",
      "kind": "DEFINES",
      "source_entity_id": "urn:codenoesis:entity:blake3:df3ec7670cebe2dedf4deb17000a4dabdce69e7fd81864914d5644d1a58ad363",
      "target_entity_id": "urn:codenoesis:entity:blake3:446c78db70ea6ef172b260f1872ce66089def9d85724f89bff0b250af15e52b0",
      "evidence_ids": [
        "evidence-s2-0003"
      ],
      "claim_id": "urn:codenoesis:claim:blake3:7fc1cb150f6c4d8c5c6350e571d2ca13b4e4ecee61e782a2a5f7c1dba00a5566"
    },
    {
      "relationship_id": "urn:codenoesis:relationship:blake3:5696bf7572914986148736698c4e5cdc307598a1d5809efad275db3a9a1db1d3",
      "kind": "DEFINES",